{
  "archive": {
    "bytes": 516784,
    "immutable": true,
    "lines": 6089,
    "path": "jarvis/docs/m62/history/PROGRESS_THROUGH_S3N.md",
    "sha256": "e0914054da4dde4b785bbdabc45a40e0f8b590c2aa3612e9432c685c0c79c1bf"
  },
  "authority_observation": {
    "control_plane_can_grant_authority": false,
    "eval": "NONE_OBSERVED_IN_REPOSITORY",
    "note": "An OBSERVATION, never a grant. Tokens live outside the repository, so this is measured as 'no tracked file carries one' and is not proof none exists elsewhere. Every authority stays governed by the single-use plan-token mechanism plus an explicit human decision.",
    "promotion": "NONE_OBSERVED_IN_REPOSITORY",
    "train": "NONE_OBSERVED_IN_REPOSITORY"
  },
  "base_model": {
    "chat_template_digest": "a55ee1b1660128b7098723e0abcd92caa0788061051c62d51cbe87d9cf1974d8",
    "evidence": "jarvis/scripts/build_quality_training_config.py",
    "model_id": "Qwen/Qwen3-0.6B",
    "revision": "c1899de289a04d12100db370d81485cdf75e47ca",
    "revision_kind": "immutable_commit",
    "training_precision": "FP32 on CPU for S3H and S3K. The S3E.2 evaluation load was observed at bfloat16 because the backend did not force FP32; that history is not rewritten."
  },
  "candidates": [
    {
      "adapter_manifest_hash": "1f76ccfbb8efc566c293ab6430d041dd24748035ed48aec6552d1e3bac24699f",
      "adapter_sha256": "43213035c15cd38928d2d6a3bdbd9af96872a954801c6bfd0a9b82a8e22ac858",
      "base_model_revision": "c1899de289a04d12100db370d81485cdf75e47ca",
      "candidate_id": "qwen3-06b-lora-quality-live-001",
      "evaluation_corpus": "m62-defensive-eval v2",
      "evidence": "jarvis/docs/V69_M62_S3I_LIVE_QUALITY_HELDOUT_EVALUATION.md",
      "ordinal": 1,
      "status": "EVALUATED_NOT_ELIGIBLE",
      "training_corpus": "m62-defensive-quality-train v1"
    },
    {
      "adapter_manifest_hash": "11897e16b081cc4df2517f1c0c0904b7b7580ab4daf8fea0157e49ee4e2f6ca8",
      "adapter_sha256": "319c252498ba51e01ed59f58fc20ae639e2d886bf67277d3aa6df2e9f9665409",
      "base_model_revision": "c1899de289a04d12100db370d81485cdf75e47ca",
      "candidate_id": "qwen3-06b-lora-quality-live-002",
      "evaluation_corpus": "m62-defensive-eval v3",
      "evidence": "jarvis/docs/V69_M62_S3L_SECOND_QUALITY_HELDOUT_EVALUATION.md",
      "ordinal": 2,
      "status": "EVALUATED_NOT_ELIGIBLE",
      "training_corpus": "m62-defensive-quality-train v2"
    },
    {
      "adapter_manifest_hash": null,
      "adapter_sha256": null,
      "base_model_revision": null,
      "candidate_id": "candidate-003",
      "evaluation_corpus": null,
      "evidence": "jarvis/docs/V69_M62_S3N_FRESH_EVAL_V4_FREEZE.md",
      "ordinal": 3,
      "status": "NOT_CREATED",
      "training_corpus": null
    }
  ],
  "control_plane_note": "This snapshot describes the repository as S3N left it. S3N.1 changed only control-plane and documentation files; it trained nothing, evaluated nothing and created no authority.",
  "datasets": [
    {
      "dataset_id": "m62-defensive-eval",
      "evidence": "jarvis/docs/V69_M62_FIRST_LIVE_ADAPTER_EVALUATION.md",
      "manifest_hash": "0970600c677c89112db972c6024634aa871be92dee303db7f429c90967d3dd3b",
      "pack_hash": "d714d89bb1842789ec254c4d14de1c467944d0d769b5b44367bd822e1655f1f0",
      "parent_manifest_hash": null,
      "role": "EVALUATION_HOLDOUT",
      "spent_by": "S3E.2, run-004 smoke evaluation",
      "status": "USED_IMMUTABLE",
      "task_count": 36,
      "version": "v1"
    },
    {
      "dataset_id": "m62-defensive-eval",
      "evidence": "jarvis/docs/V69_M62_S3I_LIVE_QUALITY_HELDOUT_EVALUATION.md",
      "manifest_hash": "82b60bfdbea263eef3990eb6e49c2f2ca16e9b9e26ec8ac435f314b374279d60",
      "pack_hash": "3744a22e1866a40b6e5b27ae20e798365dfbf2d3c071018afba14bf611ec2665",
      "parent_manifest_hash": "0970600c677c89112db972c6024634aa871be92dee303db7f429c90967d3dd3b",
      "role": "EVALUATION_HOLDOUT",
      "spent_by": "S3I LIVE, candidate 001",
      "status": "USED_IMMUTABLE",
      "task_count": 36,
      "version": "v2"
    },
    {
      "dataset_id": "m62-defensive-eval",
      "evidence": "jarvis/docs/V69_M62_S3L_SECOND_QUALITY_HELDOUT_EVALUATION.md",
      "manifest_hash": "7c948236163198b5de451316e39346a37efcbc1254724f921e116a6c722f75a0",
      "pack_hash": "28d2f7d0007c0dc410b7743aa93c168899c93b8b822afb3d3379675572c02442",
      "parent_manifest_hash": "82b60bfdbea263eef3990eb6e49c2f2ca16e9b9e26ec8ac435f314b374279d60",
      "role": "EVALUATION_HOLDOUT",
      "spent_by": "S3L, candidate 002",
      "status": "USED_IMMUTABLE",
      "task_count": 36,
      "version": "v3"
    },
    {
      "dataset_id": "m62-defensive-eval",
      "evidence": "jarvis/docs/V69_M62_S3N_FRESH_EVAL_V4_FREEZE.md",
      "manifest_hash": "8c6871b0094bdfc75062a6352d383fa8e9750c1425182a2b3248db20500081c5",
      "pack_hash": "95b4e2f6ffb495735113c236f051073449f4562b780eddfc5fe8a7f76bddf2b7",
      "parent_manifest_hash": "7c948236163198b5de451316e39346a37efcbc1254724f921e116a6c722f75a0",
      "role": "EVALUATION_HOLDOUT",
      "spent_by": null,
      "status": "FROZEN_UNUSED",
      "task_count": 36,
      "version": "v4"
    },
    {
      "dataset_id": "m62-defensive-quality-train",
      "evidence": "jarvis/docs/V69_M62_S3G_QUALITY_TRAINING_CANDIDATE_DESIGN.md",
      "manifest_hash": "9bbac2f057fd0592a30a7fdeb968655f8ea585df00966e1b920415377ab7286a",
      "pack_hash": null,
      "parent_manifest_hash": null,
      "role": "TRAINING_CORPUS",
      "spent_by": "S3H, candidate 001",
      "status": "USED_IMMUTABLE",
      "task_count": 128,
      "version": "v1"
    },
    {
      "dataset_id": "m62-defensive-quality-train",
      "evidence": "jarvis/docs/V69_M62_S3J_SECOND_QUALITY_CANDIDATE_DESIGN.md",
      "manifest_hash": "24ceb1e0677b14aaccaea2b667e6d7388530e73f2df4d7a463368500d818fc0f",
      "pack_hash": null,
      "parent_manifest_hash": "9bbac2f057fd0592a30a7fdeb968655f8ea585df00966e1b920415377ab7286a",
      "role": "TRAINING_CORPUS",
      "spent_by": "S3K, candidate 002",
      "status": "USED_IMMUTABLE",
      "task_count": 182,
      "version": "v2"
    }
  ],
  "defects": [
    {
      "evidence": "jarvis/docs/V69_M62_FIRST_LIVE_ADAPTER_EVALUATION.md",
      "id": "D25",
      "is_gate": false,
      "status": "FIXED",
      "summary": "A persisted report is serialised in run_state 'comparing'; that is the documented serialisation state, not an unfinished run. states_visited ends in completed and it contributes no blocker."
    },
    {
      "evidence": "jarvis/docs/V69_M62_S3F2_OPERATOR_RULINGS_AND_EVAL_V2.md",
      "id": "D28",
      "is_gate": false,
      "status": "OPEN",
      "summary": "The production backend never populates proposed_tool_calls, so tool_call_validity_rate is VACUOUS on both arms and the six tool_call_schema tasks decide nothing. A backend gap, not a corpus one."
    },
    {
      "evidence": "jarvis/docs/V69_M62_S3G_QUALITY_TRAINING_CANDIDATE_DESIGN.md",
      "id": "D29",
      "is_gate": false,
      "status": "ACCEPTED_KNOWN_LIMITATION",
      "summary": "looks_like_refusal recognises sixteen literal English phrasings and the held-out JSON refusal targets contain none. It bounds QG-1 and SV-5 in BOTH directions and travels into eval-v4 by design."
    },
    {
      "evidence": "jarvis/docs/V69_M62_S3G_QUALITY_TRAINING_CANDIDATE_DESIGN.md",
      "id": "D30",
      "is_gate": false,
      "status": "FIXED",
      "summary": "A plan could report is_executable true with an empty blocker list while its weights were not known to be cached. The cache is now determined before the feasibility report is built."
    },
    {
      "evidence": "jarvis/docs/V69_M62_S3G2_VALIDATION_WIRING.md",
      "id": "D31",
      "is_gate": false,
      "status": "FIXED",
      "summary": "The VALIDATION split reached the trainer as nothing across three boundaries. Do not remove the eval_dataset wiring or the closing trainer.evaluate(); validation stays diagnostic, never eligibility evidence."
    },
    {
      "evidence": "jarvis/docs/V69_M62_S3I0_EVALUATION_RUNTIME_QUALIFICATION.md",
      "id": "D32",
      "is_gate": false,
      "status": "SUPERSEDED",
      "summary": "Read as a documentation defect about eval-v2's digest; superseded by D34, whose root cause is lineage discovered from incidental build state."
    },
    {
      "evidence": "jarvis/docs/V69_M62_S3I0_EVALUATION_RUNTIME_QUALIFICATION.md",
      "id": "D33",
      "is_gate": false,
      "status": "OPEN",
      "summary": "The declared per-task generation timeout is validated, hashed and never enforced, so timeout_rate is VACUOUS. A config must state timeout_s explicitly; the policy default is 120 s."
    },
    {
      "evidence": "jarvis/docs/V69_M62_S3I1_KALI_RUNTIME_AND_CANONICAL_LINEAGE.md",
      "id": "D34",
      "is_gate": false,
      "status": "FIXED",
      "summary": "A dataset manifest digest depended on build lineage rather than content. A parent is now DECLARED in CANONICAL_LINEAGE and the build fails closed rather than degrading to genesis."
    },
    {
      "evidence": "jarvis/docs/V69_M62_S3J_SECOND_QUALITY_CANDIDATE_DESIGN.md",
      "id": "D35",
      "is_gate": false,
      "status": "OPERATOR_RULING",
      "summary": "A spent holdout becomes development evidence and may not be the sole fresh eligibility corpus for the next candidate. Each candidate needs a fresh holdout. Not a contamination claim."
    },
    {
      "evidence": "jarvis/docs/V69_M62_S3J_SECOND_QUALITY_CANDIDATE_DESIGN.md",
      "id": "D36",
      "is_gate": false,
      "status": "FIXED",
      "summary": "The promotion sanitizer matched the local account name as a plain substring, making a dataset identity a function of the building host. Do not simplify it back, and do not widen it to a word boundary either."
    },
    {
      "evidence": "jarvis/docs/V69_M62_S3M1_D37_TEMPLATE_PARITY_QUALIFICATION.md",
      "id": "D37",
      "is_gate": false,
      "status": "FIXED",